{
  "$schema": "https://json-schema.org/draft/2020-12/schema",
  "title": "RuntimeBundleManifest",
  "description": "A signed runtime bundle complete content-addressed inventory.",
  "type": "object",
  "properties": {
    "artifacts": {
      "description": "Complete sorted inventory excluding manifest, signature, and SBOM files.",
      "type": "array",
      "items": {
        "$ref": "#/$defs/BundleArtifact"
      },
      "maxItems": 100000,
      "minItems": 1
    },
    "bundle_id": {
      "description": "Stable bounded bundle identifier.",
      "type": "string",
      "maxLength": 4096,
      "minLength": 1
    },
    "bundle_version": {
      "description": "Immutable upstream or application version.",
      "type": "string",
      "maxLength": 4096,
      "minLength": 1
    },
    "content_sha256": {
      "description": "SHA-256 over the canonical ordered artifact tuple stream.",
      "type": "string",
      "pattern": "^[0-9a-f]{64}$"
    },
    "cyclonedx": {
      "description": "CycloneDX JSON document and its signed content hash.",
      "$ref": "#/$defs/SbomDocument"
    },
    "entrypoint": {
      "description": "Relative executable entrypoint, present in artifacts and executable.",
      "type": "string",
      "maxLength": 4096,
      "minLength": 1
    },
    "profile": {
      "description": "Explicit publication profile; unsigned profiles are never implicit. Only an explicitly selected unsigned-development verifier policy may tolerate a missing or arbitrary bounded detached signature; production and customer-release verification remains signature-required.",
      "$ref": "#/$defs/BundleProfile"
    },
    "runtime_components": {
      "description": "Optional verified runtime helper payloads. Bundles that provide the\nloopback sandbox must declare both entries and their artifact roles.",
      "anyOf": [
        {
          "$ref": "#/$defs/RuntimeComponents"
        },
        {
          "type": "null"
        }
      ],
      "default": null
    },
    "schema_version": {
      "description": "Manifest schema version; currently exactly two.",
      "type": "integer",
      "const": 2
    },
    "signature_status": {
      "description": "Truthful detached-signature state for this manifest.",
      "$ref": "#/$defs/SignatureStatus"
    },
    "spdx": {
      "description": "SPDX JSON document and its signed content hash.",
      "$ref": "#/$defs/SbomDocument"
    },
    "target": {
      "description": "Exact supported execution target.",
      "$ref": "#/$defs/RuntimeTarget"
    }
  },
  "additionalProperties": false,
  "required": [
    "schema_version",
    "profile",
    "signature_status",
    "bundle_id",
    "bundle_version",
    "target",
    "entrypoint",
    "artifacts",
    "content_sha256",
    "spdx",
    "cyclonedx"
  ],
  "$defs": {
    "BundleArtifact": {
      "description": "One regular file in the runtime bundle.",
      "type": "object",
      "properties": {
        "license_evidence": {
          "description": "Non-empty inventoried paths containing license evidence.",
          "type": "array",
          "items": {
            "type": "string"
          },
          "maxItems": 100000,
          "minItems": 1
        },
        "license_expression": {
          "description": "SPDX license expression attributed to this file.",
          "type": "string",
          "maxLength": 4096,
          "minLength": 1
        },
        "mode": {
          "description": "Exact Unix permission mode, excluding file-type bits.",
          "type": "integer",
          "format": "uint32",
          "maximum": 511,
          "minimum": 0
        },
        "path": {
          "description": "Normalized UTF-8 path relative to the bundle root.",
          "type": "string",
          "maxLength": 4096,
          "minLength": 1
        },
        "role": {
          "description": "Semantic role of a runtime helper payload, when applicable.",
          "anyOf": [
            {
              "$ref": "#/$defs/BundleArtifactRole"
            },
            {
              "type": "null"
            }
          ]
        },
        "sha256": {
          "description": "Lowercase SHA-256 of the file bytes.",
          "type": "string",
          "pattern": "^[0-9a-f]{64}$"
        },
        "size": {
          "description": "Exact file length.",
          "type": "integer",
          "format": "uint64",
          "minimum": 0
        }
      },
      "additionalProperties": false,
      "required": [
        "path",
        "size",
        "sha256",
        "mode",
        "license_expression",
        "license_evidence"
      ]
    },
    "BundleArtifactRole": {
      "description": "Roles reserved for the authenticated loopback runtime helpers.",
      "oneOf": [
        {
          "description": "The rootless Bubblewrap supervisor.",
          "type": "string",
          "const": "supervisor"
        },
        {
          "description": "The bounded loopback TCP-to-Unix sidecar.",
          "type": "string",
          "const": "sidecar"
        }
      ]
    },
    "BundleProfile": {
      "description": "Explicit publication profile carried by every runtime-bundle manifest.\n\nUnsigned profiles are intentionally opt-in and are never accepted by the\ndefault verifier or by formal qualification paths.",
      "oneOf": [
        {
          "description": "Production profile; the manifest must have a trusted detached signature.",
          "type": "string",
          "const": "signed"
        },
        {
          "description": "Local development profile; integrity metadata remains mandatory and this profile is never customer-release evidence. Only explicit unsigned-development verification may tolerate a missing or arbitrary bounded detached signature.",
          "type": "string",
          "const": "unsigned-development"
        },
        {
          "description": "Explicit non-customer staging profile; it remains strict about detached-signature absence and is never customer-release evidence.",
          "type": "string",
          "const": "unsigned-release"
        }
      ]
    },
    "RuntimeComponents": {
      "description": "Paths of the signed helper payloads consumed by the sandbox launcher.",
      "type": "object",
      "properties": {
        "sidecar": {
          "description": "Relative path of the sidecar executable.",
          "type": "string",
          "maxLength": 4096,
          "minLength": 1
        },
        "supervisor": {
          "description": "Relative path of the supervisor executable.",
          "type": "string",
          "maxLength": 4096,
          "minLength": 1
        }
      },
      "additionalProperties": false,
      "required": [
        "supervisor",
        "sidecar"
      ]
    },
    "RuntimeTarget": {
      "description": "Exact runtime platform identity.",
      "type": "object",
      "properties": {
        "architecture": {
          "description": "CPU architecture, such as x86_64 or aarch64.",
          "type": "string",
          "maxLength": 4096,
          "minLength": 1
        },
        "libc": {
          "description": "libc family, such as glibc or musl.",
          "type": "string",
          "maxLength": 4096,
          "minLength": 1
        },
        "libc_version": {
          "description": "Exact libc ABI version required by the bundle.",
          "type": "string",
          "maxLength": 4096,
          "minLength": 1
        },
        "operating_system": {
          "description": "Operating-system identifier, such as linux.",
          "type": "string",
          "maxLength": 4096,
          "minLength": 1
        }
      },
      "additionalProperties": false,
      "required": [
        "operating_system",
        "architecture",
        "libc",
        "libc_version"
      ]
    },
    "SbomDocument": {
      "description": "Signed identity of one SBOM document.",
      "type": "object",
      "properties": {
        "path": {
          "description": "Normalized relative path to the JSON document.",
          "type": "string",
          "maxLength": 4096,
          "minLength": 1
        },
        "sha256": {
          "description": "Lowercase SHA-256 of its exact bytes.",
          "type": "string",
          "pattern": "^[0-9a-f]{64}$"
        }
      },
      "additionalProperties": false,
      "required": [
        "path",
        "sha256"
      ]
    },
    "SignatureStatus": {
      "description": "Truthful signature state recorded in public bundle metadata.",
      "oneOf": [
        {
          "description": "The detached manifest signature is present and verified.",
          "type": "string",
          "const": "signed"
        },
        {
          "description": "No detached manifest signature is present.",
          "type": "string",
          "const": "unsigned"
        }
      ]
    }
  }
}
